{
  "$schema": "./schemas/agent-registry.schema.json",
  "version": "3.1.0",
  "description": "Dynamic agent and skill registry with implementation-focused agents (2025 best practices). Split ai-ml-engineer into 3 specialized agents: data-pipeline-engineer, llm-integrator, workflow-architect. Removed low-value orchestration/planning agents, added database-engineer, security-auditor, test-generator, debug-investigator",
  "last_updated": "2025-12-29",

  "discovery": {
    "protocol": "semantic",
    "fallback": "keyword",
    "confidence_threshold": 0.7,
    "max_agents_per_task": 3
  },

  "agents": {
    "backend-system-architect": {
      "display_name": "Backend System Architect",
      "color": "yellow",
      "model_preference": {
        "design": "sonnet",
        "simple_queries": "haiku",
        "complex_analysis": "opus"
      },
      "capabilities": [
        "api-design",
        "database-schema",
        "authentication",
        "authorization",
        "rate-limiting",
        "microservices",
        "rest-api",
        "graphql",
        "caching",
        "webhooks"
      ],
      "can_solve_examples": [
        "How do I add a paginated endpoint?",
        "Design a database schema for user preferences",
        "Implement JWT refresh tokens",
        "Add rate limiting to the API",
        "Create a webhook system",
        "Design microservice boundaries"
      ],
      "skills_used": [
        "api-design-framework",
        "database-schema-designer",
        "security-checklist",
        "streaming-api-patterns",
        "observability-monitoring",
        "performance-optimization",
        "devops-deployment",
        "golden-dataset-management",
        "edge-computing-patterns",
        "github-cli",
        "resilience-patterns",
        "langgraph-workflows"
      ],
      "tools": ["Read", "Edit", "MultiEdit", "Write", "Bash", "Grep", "Glob"],
      "boundaries": {
        "allowed": ["backend/**", "api/**", "database/**", "services/**"],
        "forbidden": ["frontend/**", "components/**", "styles/**"]
      },
      "handoff_to": ["code-quality-reviewer", "frontend-ui-developer"],
      "mcp_tools": {
        "documentation": ["context7"],
        "testing": ["skillforge-postgres-dev"],
        "discovery": ["mcp-find"]
      }
    },

    "frontend-ui-developer": {
      "display_name": "Frontend UI Developer",
      "color": "purple",
      "model_preference": {
        "components": "sonnet",
        "simple_styling": "haiku",
        "complex_state": "sonnet"
      },
      "capabilities": [
        "react-components",
        "typescript-frontend",
        "state-management",
        "responsive-design",
        "accessibility",
        "performance-optimization",
        "hooks",
        "forms",
        "animations"
      ],
      "can_solve_examples": [
        "Create a login form component",
        "Build a responsive dashboard layout",
        "Implement dark mode toggle",
        "Add form validation with error states",
        "Create a reusable modal component",
        "Optimize component re-renders"
      ],
      "skills_used": [
        "react-server-components-framework",
        "design-system-starter",
        "type-safety-validation",
        "testing-strategy-builder",
        "webapp-testing"
      ],
      "tools": ["Read", "Edit", "MultiEdit", "Write", "Bash", "Grep", "Glob"],
      "boundaries": {
        "allowed": ["frontend/**", "components/**", "styles/**", "hooks/**"],
        "forbidden": ["backend/**", "api/**", "database/**"]
      },
      "handoff_to": ["code-quality-reviewer", "test-generator"],
      "mcp_tools": {
        "documentation": ["context7"],
        "testing": ["playwright"],
        "discovery": ["mcp-find"]
      }
    },

    "data-pipeline-engineer": {
      "display_name": "Data Pipeline Engineer",
      "color": "emerald",
      "model_preference": {
        "batch_processing": "sonnet",
        "simple_ops": "haiku"
      },
      "capabilities": [
        "embeddings",
        "chunking",
        "vector-indexing",
        "data-transformation",
        "batch-processing",
        "cache-warming",
        "data-quality"
      ],
      "can_solve_examples": [
        "Regenerate embeddings for the docs folder",
        "Implement semantic chunking with overlap",
        "Rebuild HNSW index with new config",
        "Warm cache with common queries",
        "Validate embedding quality metrics",
        "Transform raw content for embedding"
      ],
      "skills_used": [
        "ai-native-development",
        "pgvector-search",
        "golden-dataset-management"
      ],
      "tools": ["Bash", "Read", "Write", "Edit", "Grep", "Glob"],
      "boundaries": {
        "allowed": ["backend/app/shared/services/embeddings/**", "backend/scripts/**", "tests/unit/services/**"],
        "forbidden": ["frontend/**", "workflow_definitions/**"]
      },
      "handoff_to": ["database-engineer", "llm-integrator"],
      "mcp_tools": {
        "database": ["postgres-mcp"],
        "documentation": ["context7"],
        "discovery": ["mcp-find"]
      }
    },

    "llm-integrator": {
      "display_name": "LLM Integrator",
      "color": "orange",
      "model_preference": {
        "prompt_engineering": "sonnet",
        "integration": "sonnet",
        "simple_queries": "haiku"
      },
      "capabilities": [
        "llm-integration",
        "prompt-engineering",
        "function-calling",
        "streaming-responses",
        "cost-optimization",
        "provider-fallback",
        "rate-limiting"
      ],
      "can_solve_examples": [
        "Integrate OpenAI API with streaming",
        "Design versioned prompt templates",
        "Add function calling to the chat endpoint",
        "Implement prompt caching for cost reduction",
        "Set up provider fallback chain",
        "Configure Langfuse tracing"
      ],
      "skills_used": [
        "ai-native-development",
        "streaming-api-patterns",
        "llm-caching-patterns",
        "langfuse-observability",
        "resilience-patterns"
      ],
      "tools": ["Read", "Edit", "MultiEdit", "Write", "Bash", "WebFetch", "Grep", "Glob"],
      "boundaries": {
        "allowed": ["backend/app/shared/services/llm/**", "backend/app/api/**", "prompts/**"],
        "forbidden": ["embedding_generation/**", "workflow_graphs/**"]
      },
      "handoff_to": ["test-generator", "workflow-architect"],
      "mcp_tools": {
        "prompts": ["langfuse"],
        "documentation": ["context7"],
        "discovery": ["mcp-find"]
      }
    },

    "workflow-architect": {
      "display_name": "Workflow Architect",
      "color": "blue",
      "model_preference": {
        "architecture": "opus",
        "simple_graphs": "sonnet"
      },
      "capabilities": [
        "langgraph",
        "multi-agent",
        "state-management",
        "supervisor-worker",
        "conditional-routing",
        "checkpointing",
        "rag-orchestration"
      ],
      "can_solve_examples": [
        "Design a multi-agent analysis pipeline",
        "Implement supervisor-worker pattern",
        "Add checkpointing to workflow for fault tolerance",
        "Create conditional routing based on state",
        "Orchestrate RAG retrieval pipeline",
        "Configure parallel agent execution"
      ],
      "skills_used": [
        "langgraph-workflows",
        "ai-native-development",
        "langfuse-observability",
        "observability-monitoring"
      ],
      "tools": ["Bash", "Read", "Write", "Edit", "Grep", "Glob"],
      "boundaries": {
        "allowed": ["backend/app/workflows/**", "backend/app/services/**", "docs/workflows/**"],
        "forbidden": ["frontend/**", "direct_llm_calls/**"]
      },
      "handoff_to": ["llm-integrator", "data-pipeline-engineer"],
      "mcp_tools": {
        "reasoning": ["sequential-thinking"],
        "memory": ["memory"],
        "documentation": ["context7"],
        "discovery": ["mcp-find"]
      }
    },

    "code-quality-reviewer": {
      "display_name": "Code Quality Reviewer",
      "color": "green",
      "model_preference": {
        "security_review": "opus",
        "lint_check": "haiku",
        "architecture_review": "sonnet"
      },
      "capabilities": [
        "code-review",
        "security-audit",
        "linting",
        "type-checking",
        "test-coverage",
        "performance-review",
        "dependency-audit",
        "best-practices"
      ],
      "can_solve_examples": [
        "Review this PR for security issues",
        "Check test coverage for the auth module",
        "Run linting and fix violations",
        "Audit dependencies for vulnerabilities",
        "Review code for performance issues",
        "Validate TypeScript strict mode compliance"
      ],
      "skills_used": [
        "code-review-playbook",
        "security-checklist",
        "testing-strategy-builder",
        "evidence-verification",
        "webapp-testing",
        "resilience-patterns"
      ],
      "tools": ["Read", "Bash", "Grep", "Glob"],
      "boundaries": {
        "allowed": ["**/*.test.*", "**/*.spec.*", "tests/**"],
        "forbidden_actions": ["direct_implementation", "architecture_changes"]
      },
      "handoff_to": [],
      "mcp_tools": {
        "diagnostics": ["ide"],
        "discovery": ["mcp-find"]
      }
    },

    "database-engineer": {
      "display_name": "Database Engineer",
      "color": "emerald",
      "model_preference": {
        "schema_design": "sonnet",
        "query_optimization": "sonnet",
        "simple_migrations": "haiku"
      },
      "capabilities": [
        "schema-design",
        "migrations",
        "query-optimization",
        "indexing",
        "pgvector",
        "full-text-search",
        "constraints",
        "normalization"
      ],
      "can_solve_examples": [
        "Design a schema for user feedback",